,ape,ape_name,ape_len,ape_cat0,ape_cat1,ape_cat2,ape_cat3,ape_cat4,enthic
1139,641,Intermédiation monétaire,3,64,1,,,,1139
1140,471,Commerce de détail en magasin non spécialisé,3,47,1,,,,1140
1141,8220,Activités de centres d'appels,4,82,2,0,,,1141
1142,8810B,Accueil accompagn. sans héberg. adultes handicapés ou pers. âgées,5,88,1,0,B,,1142
1143,4611,"Interm. du comm. en m.p. agricoles & textiles, animaux vivants",4,46,1,1,,,1143
1144,4673,"Comm. gros bois, matériaux de construction & appareils sanitaires",4,46,7,3,,,1144
1145,9420,Activités des syndicats de salariés,4,94,2,0,,,1145
1146,701,Activités des sièges sociaux,3,70,1,,,,1146
1147,8430B,Gestion des retraites complémentaires,5,84,3,0,B,,1147
1148,2343Z,Fabrication d'isolateurs et pièces isolantes en céramique,5,23,4,3,Z,,1148
1149,255,"Forge, emboutissage, estampage; métallurgie des poudres",3,25,5,,,,1149
1150,601,Édition et diffusion de programmes radio,3,60,1,,,,1150
1151,6130,Télécommunications par satellite,4,61,3,0,,,1151
1152,7500,Activités vétérinaires,4,75,0,0,,,1152
1153,8551,Enseignement de disciplines sportives et d'activités de loisirs,4,85,5,1,,,1153
1154,120,Fabrication de produits à base de tabac,3,12,0,,,,1154
1155,4519,Commerce d'autres véhicules automobiles,4,45,1,9,,,1155
1156,5110Z,Transports aériens de passagers,5,51,1,0,Z,,1156
1157,3811Z,Collecte des déchets non dangereux,5,38,1,1,Z,,1157
1158,4675Z,Commerce de gros de produits chimiques,5,46,7,5,Z,,1158
1159,2443,"Métallurgie du plomb, du zinc ou de l'étain",4,24,4,3,,,1159
1160,791,Activités des agences de voyage et voyagistes,3,79,1,,,,1160
1161,2829B,Fabrication d'autres machines d'usage général,5,28,2,9,B,,1161
1162,467,Autres commerces de gros spécialisés,3,46,7,,,,1162
1163,2640Z,Fabrication de produits électroniques grand public,5,26,4,0,Z,,1163
1164,2821Z,Fabrication de fours et brûleurs,5,28,2,1,Z,,1164
1165,3313,Réparation de matériels électroniques et optiques,4,33,1,3,,,1165
1166,6511,Assurance vie,4,65,1,1,,,1166
1167,9412,Activités des organisations professionnelles,4,94,1,2,,,1167
1168,2811,Fabrication moteurs & turbines sf moteurs d'avions & de véhicules,4,28,1,1,,,1168
1169,4942Z,Services de déménagement,5,49,4,2,Z,,1169
1170,8413,Administration publique (tutelle) des activités économiques,4,84,1,3,,,1170
1171,661,"Activ. auxil. serv. financiers, hors assurance & caisses retraite",3,66,1,,,,1171
1172,2352,Fabrication de chaux et plâtre,4,23,5,2,,,1172
1173,691,Activités juridiques,3,69,1,,,,1173
1174,93,"Activités sportives, récréatives et de loisirs",2,93,,,,,1174
1175,1107B,Production de boissons rafraîchissantes,5,11,0,7,B,,1175
1176,2562,Usinage,4,25,6,2,,,1176
1177,4723Z,Comm. détail poissons crustacés & mollusques (magasin spécialisé),5,47,2,3,Z,,1177
1178,4532,Commerce de détail d'équipements automobiles,4,45,3,2,,,1178
1179,4649,Commerce de gros d'autres biens domestiques,4,46,4,9,,,1179
1180,1721B,Fabrication de cartonnages,5,17,2,1,B,,1180
1181,8412,Adm. pub. tutelle santé form. cult. & social (aut que sécu. soc.),4,84,1,2,,,1181
1182,4311Z,Travaux de démolition,5,43,1,1,Z,,1182
1183,4751Z,Commerce de détail de textiles en magasin spécialisé,5,47,5,1,Z,,1183
1184,474,Comm. détail équipts de l'information & communic. (magas. spéc.),3,47,4,,,,1184
1185,5223Z,Services auxiliaires des transports aériens,5,52,2,3,Z,,1185
1186,4613,Intermédiaires du commerce en bois et matériaux de construction,4,46,1,3,,,1186
1187,8559A,Formation continue d'adultes,5,85,5,9,A,,1187
1188,4761Z,Commerce de détail de livres en magasin spécialisé,5,47,6,1,Z,,1188
1189,5630Z,Débits de boissons,5,56,3,0,Z,,1189
1190,6202,Conseil informatique,4,62,0,2,,,1190
1191,254,Fabrication d'armes et de munitions,3,25,4,,,,1191
1192,4520,Entretien et réparation de véhicules automobiles,4,45,2,0,,,1192
1193,253,Fabric. générateurs vapeur sf chaudières pour chauffage central,3,25,3,,,,1193
1194,252,"Fabrication de réservoirs, citernes et conteneurs métalliques",3,25,2,,,,1194
1195,6630Z,Gestion de fonds,5,66,3,0,Z,,1195
1196,124,Culture de fruits à pépins et à noyau,3,12,4,,,,1196
1197,59,Prod. films cinémat. vidéo & prog.TV; enrg. sonore & éd. musicale,2,59,,,,,1197
1198,3821,Traitement et élimination des déchets non dangereux,4,38,2,1,,,1198
1199,4777Z,Comm. détail d'articles horlogerie & bijouterie (magas. spéc.),5,47,7,7,Z,,1199
1200,9604,Entretien corporel,4,96,0,4,,,1200
1201,2830,Fabrication de machines agricoles et forestières,4,28,3,0,,,1201
1202,477,Autres commerces de détail en magasin spécialisé,3,47,7,,,,1202
1203,4399C,Travaux de maçonnerie générale et gros oeuvre de bâtiment,5,43,9,9,C,,1203
1204,3030,Construction aéronautique et spatiale,4,30,3,0,,,1204
1205,1073Z,Fabrication de pâtes alimentaires,5,10,7,3,Z,,1205
1206,2312,Façonnage et transformation du verre plat,4,23,1,2,,,1206
1207,3511,Production d'électricité,4,35,1,1,,,1207
1208,3091Z,Fabrication de motocycles,5,30,9,1,Z,,1208
1209,4645,Commerce de gros de parfumerie et de produits de beauté,4,46,4,5,,,1209
1210,1511Z,"Apprêt, tannage des cuirs; préparation et teinture des fourrures",5,15,1,1,Z,,1210
1211,2444,Métallurgie du cuivre,4,24,4,4,,,1211
1212,2562A,Décolletage,5,25,6,2,A,,1212
1213,3832Z,Récupération de déchets triés,5,38,3,2,Z,,1213
1214,4942,Services de déménagement,4,49,4,2,,,1214
1215,5222,Services auxiliaires des transports par eau,4,52,2,2,,,1215
1216,2361,Fabrication d'éléments en béton pour la construction,4,23,6,1,,,1216
1217,2751,Fabrication d'appareils électroménagers,4,27,5,1,,,1217
1218,3240Z,Fabrication de jeux et jouets,5,32,4,0,Z,,1218
1219,8291,Activ. de recouvrement factures & d'info. financ. s/la clientèle,4,82,9,1,,,1219
1220,162,"Fabrication d'articles en bois, liège, vannerie et sparterie",3,16,2,,,,1220
1221,2732Z,Fabrication d'autres fils et câbles électroniques ou électriques,5,27,3,2,Z,,1221
1222,1610,Sciage et rabotage du bois,4,16,1,0,,,1222
1223,8690E,Activité profess. rééducation appareillage & pédicures-podologues,5,86,9,0,E,,1223
1224,960,Autres services personnels,3,96,0,,,,1224
1225,91,"Bibliothèques, archives, musées et autres activités culturelles",2,91,,,,,1225
1226,2120,Fabrication de préparations pharmaceutiques,4,21,2,0,,,1226
1227,681,Activités des marchands de biens immobiliers,3,68,1,,,,1227
1228,203,"Fabrication de peintures, vernis, encres et mastics",3,20,3,,,,1228
1229,4213B,Construction et entretien de tunnels,5,42,1,3,B,,1229
1230,4639,"Commerce de gros non spécialisé de denrées, boissons et tabac",4,46,3,9,,,1230
1231,4632B,Commerce de gros de produits à base de viande,5,46,3,2,B,,1231
1232,1013A,Préparation industrielle de produits à base de viande,5,10,1,3,A,,1232
1233,4664,Comm. gros (interentr.) machines pour industrie textile & habill.,4,46,6,4,,,1233
1234,9002Z,Activités de soutien au spectacle vivant,5,90,0,2,Z,,1234
1235,6430,Fonds de placement et entités financières similaires,4,64,3,0,,,1235
1236,2431Z,Étirage à froid de barres,5,24,3,1,Z,,1236
1237,4399A,Travaux d'étanchéification,5,43,9,9,A,,1237
1238,6621Z,Évaluation des risques et dommages,5,66,2,1,Z,,1238
1239,1729Z,Fabrication d'autres articles en papier ou en carton,5,17,2,9,Z,,1239
1240,1086Z,Fabrication d'aliments homogénéisés et diététiques,5,10,8,6,Z,,1240
1241,4939C,Téléphériques et remontées mécaniques,5,49,3,9,C,,1241
1242,7420,Activités photographiques,4,74,2,0,,,1242
1243,9609Z,Autres services personnels n.c.a.,5,96,0,9,Z,,1243
1244,9311,Gestion d'installations sportives,4,93,1,1,,,1244
1245,729,Extraction d'autres minerais de métaux non ferreux,3,72,9,,,,1245
1246,8891,Action sociale sans hébergement pour jeunes enfants,4,88,9,1,,,1246
1247,6312Z,Portails Internet,5,63,1,2,Z,,1247
1248,8810C,Aide par le travail,5,88,1,0,C,,1248
1249,3109,Fabrication d'autres meubles,4,31,0,9,,,1249
1250,4623,Commerce de gros d'animaux vivants,4,46,2,3,,,1250
1251,8622B,Activités chirurgicales,5,86,2,2,B,,1251
1252,111,"Culture de céréales (sf riz) légumineuses, graines oléagineuses",3,11,1,,,,1252
1253,5610,Restaurants et services de restauration mobile,4,56,1,0,,,1253
1254,2041,"Fabrication de savons, détergents et produits d'entretien",4,20,4,1,,,1254
1255,9002,Activités de soutien au spectacle vivant,4,90,0,2,,,1255
1256,4672Z,Commerce de gros de minerais et métaux,5,46,7,2,Z,,1256
1257,4321,Installation électrique,4,43,2,1,,,1257
1258,4777,Comm. détail d'articles horlogerie & bijouterie (magas. spéc.),4,47,7,7,,,1258
1259,152,Fabrication de chaussures,3,15,2,,,,1259
1260,4677,Commerce de gros de déchets et débris,4,46,7,7,,,1260
1261,5819Z,Autres activités d'édition,5,58,1,9,Z,,1261
1262,651,Assurance,3,65,1,,,,1262
1263,4110D,Supports juridiques de programmes,5,41,1,0,D,,1263
1264,1102A,Fabrication de vins effervescents,5,11,0,2,A,,1264
1265,6120,Télécommunications sans fil,4,61,2,0,,,1265
1266,7120,Activités de contrôle et analyses techniques,4,71,2,0,,,1266
1267,0113Z,"Culture de légumes, de melons, de racines et de tubercules",5,01,1,3,Z,,1267
1268,2015Z,Fabrication de produits azotés et d'engrais,5,20,1,5,Z,,1268
1269,4332,Travaux de menuiserie,4,43,3,2,,,1269
1270,6499,"Autres activ. serv. financiers sf assurance & c. de retraite, nca",4,64,9,9,,,1270
1271,2573,Fabrication d'outillage,4,25,7,3,,,1271
1272,742,Activités photographiques,3,74,2,,,,1272
1273,125,Culture d'aut. fruits d'arbres ou d'arbustes et de fruits a coque,3,12,5,,,,1273
1274,4752B,"Comm. détail de quincaillerie, peintures et verres (mag.> 400 m2)",5,47,5,2,B,,1274
1275,510,Extraction de houille,3,51,0,,,,1275
1276,2313Z,Fabrication de verre creux,5,23,1,3,Z,,1276
1277,2732,Fabrication d'autres fils et câbles électroniques ou électriques,4,27,3,2,,,1277
1278,3102Z,Fabrication de meubles de cuisine,5,31,0,2,Z,,1278
1279,952,Réparation de biens personnels et domestiques,3,95,2,,,,1279
1280,6619B,"Aut. activ. auxil. serv. financ., hors assur. & caisse retr. nca.",5,66,1,9,B,,1280
1281,98,Activ. ménages : prod. biens & services (usage propre),2,98,,,,,1281
1282,3291Z,Fabrication d’articles de brosserie,5,32,9,1,Z,,1282
1283,383,Récupération,3,38,3,,,,1283
1284,281,Fabrication de machines d'usage général,3,28,1,,,,1284
1285,843,Sécurité sociale obligatoire,3,84,3,,,,1285
1286,123,Culture d'agrumes,3,12,3,,,,1286
1287,3522Z,Distribution de combustibles gazeux par conduites,5,35,2,2,Z,,1287
1288,4642Z,Commerce de gros d'habillement et de chaussures,5,46,4,2,Z,,1288
1289,4624Z,Commerce de gros (commerce interentreprises) de cuirs et peaux,5,46,2,4,Z,,1289
1290,85,Enseignement,2,85,,,,,1290
1291,2060,Fabrication de fibres artificielles ou synthétiques,4,20,6,0,,,1291
1292,1083Z,Transformation du thé et du café,5,10,8,3,Z,,1292
1293,4723,Comm. détail poissons crustacés & mollusques (magasin spécialisé),4,47,2,3,,,1293
1294,465,Comm. gros équipts de l'information et de la communication,3,46,5,,,,1294
1295,8553Z,Enseignement de la conduite,5,85,5,3,Z,,1295
1296,1399,Fabrication d'autres textiles n.c.a.,4,13,9,9,,,1296
1297,56,Restauration,2,56,,,,,1297
1298,7490A,Activité des économistes de la construction,5,74,9,0,A,,1298
1299,8299,Autres activités de soutien aux entreprises n.c.a.,4,82,9,9,,,1299
1300,1721A,Fabrication de carton ondulé,5,17,2,1,A,,1300
1301,2341,"Fabrication d'articles céramiques à usage domestique, ornemental",4,23,4,1,,,1301
1302,2444Z,Métallurgie du cuivre,5,24,4,4,Z,,1302
1303,4652,Comm. de gros d'éqpts et composants électroniques et de télécomm.,4,46,5,2,,,1303
1304,4221Z,Construction de réseaux pour fluides,5,42,2,1,Z,,1304
1305,1814Z,Reliure et activités connexes,5,18,1,4,Z,,1305
1306,2529Z,"Fabrication d'autres réservoirs, citernes, conteneurs métalliques",5,25,2,9,Z,,1306
1307,353,Production et distribution de vapeur et d'air conditionné,3,35,3,,,,1307
1308,2841Z,Fabrication de machines-outils pour le travail des métaux,5,28,4,1,Z,,1308
1309,7990Z,Autres services de réservation et activités connexes,5,79,9,0,Z,,1309
1310,0164Z,Traitement des semences,5,01,6,4,Z,,1310
1311,2221Z,"Fabrication plaques, feuilles, tubes et profilés en plastique",5,22,2,1,Z,,1311
1312,2712Z,Fabrication de matériel de distribution et de commande électrique,5,27,1,2,Z,,1312
1313,172,Fabrication d'articles en papier ou en carton,3,17,2,,,,1313
1314,2391Z,Fabrication de produits abrasifs,5,23,9,1,Z,,1314
1315,1039A,Autre transformation et conservation de légumes,5,10,3,9,A,,1315
1316,0321Z,Aquaculture en mer,5,03,2,1,Z,,1316
1317,3109A,Fabrication de sièges d'ameublement d'intérieur,5,31,0,9,A,,1317
1318,1910,Cokéfaction,4,19,1,0,,,1318
1319,8425,Services du feu et de secours,4,84,2,5,,,1319
1320,2452Z,Fonderie d'acier,5,24,5,2,Z,,1320
1321,1395Z,"Fabrication de non-tissés, sauf habillement",5,13,9,5,Z,,1321
1322,1392Z,"Fabrication d'articles textiles, sauf habillement",5,13,9,2,Z,,1322
1323,421,Construction de routes et de voies ferrées,3,42,1,,,,1323
1324,4722,Comm. détail viandes & produits à base de viande (magas. spéc.),4,47,2,2,,,1324
1325,6010Z,Édition et diffusion de programmes radio,5,60,1,0,Z,,1325
1326,1722Z,Fabrication d'articles en papier à usage sanitaire ou domestique,5,17,2,2,Z,,1326
1327,8129A,"Désinfection, désinsectisation, dératisation",5,81,2,9,A,,1327
1328,4110A,Promotion immobilière de logements,5,41,1,0,A,,1328
1329,129,Autres cultures permanentes,3,12,9,,,,1329
1330,3512Z,Transport d'électricité,5,35,1,2,Z,,1330
1331,266,Fab. éqpts d'irradiation médic. électromédic. & électrothérapeut.,3,26,6,,,,1331
1332,0128Z,Culture plantes à épices aromatiques médicinales pharmaceutiques,5,01,2,8,Z,,1332
1333,1083,Transformation du thé et du café,4,10,8,3,,,1333
1334,2410Z,Sidérurgie,5,24,1,0,Z,,1334
1335,4334Z,Travaux de peinture et vitrerie,5,43,3,4,Z,,1335
1336,2822,Fabrication de matériel de levage et de manutention,4,28,2,2,,,1336
1337,52,Extraction de lignite,2,52,,,,,1337
1338,4110B,Promotion immobilière de bureaux,5,41,1,0,B,,1338
1339,7712Z,Location et location-bail de camions,5,77,1,2,Z,,1339
1340,3103Z,Fabrication de matelas,5,31,0,3,Z,,1340
1341,5221Z,Services auxiliaires des transports terrestres,5,52,2,1,Z,,1341
1342,2011,Fabrication de gaz industriels,4,20,1,1,,,1342
1343,2222Z,Fabrication d'emballages en matières plastiques,5,22,2,2,Z,,1343
1344,3821Z,Traitement et élimination des déchets non dangereux,5,38,2,1,Z,,1344
1345,429,Construction d'autres ouvrages de génie civil,3,42,9,,,,1345
1346,4312,Travaux de préparation des sites,4,43,1,2,,,1346
1347,4762Z,Commerce de détail de journaux et papeterie en magasin spécialisé,5,47,6,2,Z,,1347
1348,4941C,Location de camions avec chauffeur,5,49,4,1,C,,1348
1349,3311,Réparation d'ouvrages en métaux,4,33,1,1,,,1349
1350,461,Intermédiaires du commerce de gros,3,46,1,,,,1350
1351,1107,Industrie des eaux embouteillées et des boissons rafraîchissantes,4,11,0,7,,,1351
1352,522,Services auxiliaires des transports,3,52,2,,,,1352
1353,3513Z,Distribution d'électricité,5,35,1,3,Z,,1353
1354,2369Z,"Fabrication d'autres ouvrages en béton, en ciment ou en plâtre",5,23,6,9,Z,,1354
1355,2331,Fabrication de carreaux en céramique,4,23,3,1,,,1355
1356,1724Z,Fabrication de papiers peints,5,17,2,4,Z,,1356
1357,2841,Fabrication de machines de formage des métaux,4,28,4,1,,,1357
1358,2652Z,Horlogerie,5,26,5,2,Z,,1358
1359,773,"Location et location-bail d'autres machines, équipements et biens",3,77,3,,,,1359
1360,1042Z,Fabrication de margarine et graisses comestibles similaires,5,10,4,2,Z,,1360
1361,1104,Production d'autres boissons fermentées non distillées,4,11,0,4,,,1361
1362,5210,Entreposage et stockage,4,52,1,0,,,1362
1363,204,"Fabrication de savons, de produits d'entretien et de parfums",3,20,4,,,,1363
1364,2849Z,Fabrication d'autres machines-outils,5,28,4,9,Z,,1364
1365,2364Z,Fabrication de mortiers et bétons secs,5,23,6,4,Z,,1365
1366,245,Fonderie,3,24,5,,,,1366
1367,7500Z,Activités vétérinaires,5,75,0,0,Z,,1367
1368,303,Construction aéronautique et spatiale,3,30,3,,,,1368
1369,631,"Trt de données, hébergement & activ. connexes; portails Internet",3,63,1,,,,1369
1370,7729Z,Location et location-bail autres biens personnels et domestiques,5,77,2,9,Z,,1370
1371,8690D,Activités des infirmiers et des sages-femmes,5,86,9,0,D,,1371
1372,09,Services de soutien aux industries extractives,2,09,,,,,1372
1373,4646Z,Commerce de gros de produits pharmaceutiques,5,46,4,6,Z,,1373
1374,1439Z,Fabrication d'autres articles à mailles,5,14,3,9,Z,,1374
1375,591,"Activités cinématographiques, vidéo et de télévision",3,59,1,,,,1375
1376,2733,Fabrication de matériel d'installation électrique,4,27,3,3,,,1376
1377,521,Entreposage et stockage,3,52,1,,,,1377
1378,2720Z,Fabrication de piles et d'accumulateurs électriques,5,27,2,0,Z,,1378
1379,3900,Dépollution et autres services de gestion des déchets,4,39,0,0,,,1379
1380,853,Enseignement secondaire,3,85,3,,,,1380
1381,1061A,Meunerie,5,10,6,1,A,,1381
1382,3315Z,Réparation et maintenance navale,5,33,1,5,Z,,1382
1383,4725,Commerce de détail de boissons en magasin spécialisé,4,47,2,5,,,1383
1384,2433Z,Profilage à froid par formage ou pliage,5,24,3,3,Z,,1384
1385,1910Z,Cokéfaction,5,19,1,0,Z,,1385
1386,2752,Fabrication d'appareils ménagers non électriques,4,27,5,2,,,1386
1387,2814,Fabrication d'autres articles de robinetterie,4,28,1,4,,,1387
1388,331,"Réparation d'ouvrages en métaux, de machines et d'équipements",3,33,1,,,,1388
1389,4331Z,Travaux de plâtrerie,5,43,3,1,Z,,1389
1390,3212,Fabrication d’articles de joaillerie et bijouterie,4,32,1,2,,,1390
1391,772,Location et location-bail de biens personnels et domestiques,3,77,2,,,,1391
1392,9104,Gest. des jardins botaniques et zoolog. et des réserv. naturelles,4,91,0,4,,,1392
1393,8710A,Hébergement médicalisé pour personnes âgées,5,87,1,0,A,,1393
1394,4666Z,Commerce de gros d'autres machines et équipements de bureau,5,46,6,6,Z,,1394
1395,4322,"Travaux plomberie, install. chauffage & conditionnement d'air",4,43,2,2,,,1395
1396,2434,Tréfilage à froid,4,24,3,4,,,1396
1397,5224A,Manutention portuaire,5,52,2,4,A,,1397
1398,9319Z,Autres activités liées au sport,5,93,1,9,Z,,1398
1399,1105Z,Fabrication de bière,5,11,0,5,Z,,1399
1400,96,Autres services personnels,2,96,,,,,1400
1401,5912Z,Post-production films cinématograph. vidéo & prog. de télévision,5,59,1,2,Z,,1401
1402,5310Z,Activ. poste dans le cadre d'une obligation de service universel,5,53,1,0,Z,,1402
1403,2823Z,Fab. machines équipts bureau (sf ordinateurs & équipts périph.),5,28,2,3,Z,,1403
1404,4782,Comm. détail textiles habillt & chaussures s/éventaires & marchés,4,47,8,2,,,1404
1405,1729,Fabrication d'autres articles en papier ou en carton,4,17,2,9,,,1405
1406,3522,Distribution de combustibles gazeux par conduites,4,35,2,2,,,1406
1407,5221,Services auxiliaires des transports terrestres,4,52,2,1,,,1407
1408,1623,Fabrication de charpentes et d'autres menuiseries,4,16,2,3,,,1408
1409,2362,Fabrication d'éléments en plâtre pour la construction,4,23,6,2,,,1409
1410,9900,Activités des organisations et organismes extraterritoriaux,4,99,0,0,,,1410
1411,411,Promotion immobilière,3,41,1,,,,1411
1412,2571Z,Fabrication de coutellerie,5,25,7,1,Z,,1412
1413,5630,Débits de boissons,4,56,3,0,,,1413
1414,65,Assurance,2,65,,,,,1414
1415,4641Z,Commerce de gros (commerce interentreprises) de textiles,5,46,4,1,Z,,1415
1416,9609,Autres services personnels n.c.a.,4,96,0,9,,,1416
1417,106,Travail des grains ; fabrication de produits amylacés,3,10,6,,,,1417
1418,64,"Activ. services financiers, hors assurance & caisses de retraite",2,64,,,,,1418
1419,5621Z,Services des traiteurs,5,56,2,1,Z,,1419
1420,3831Z,Démantèlement d'épaves,5,38,3,1,Z,,1420
1421,4110,Promotion immobilière,4,41,1,0,,,1421
1422,1084Z,Fabrication de condiments et assaisonnements,5,10,8,4,Z,,1422
1423,6020,Programmation de télévision et télédiffusion,4,60,2,0,,,1423
1424,4765,Commerce de détail de jeux et jouets en magasin spécialisé,4,47,6,5,,,1424
1425,8542Z,Enseignement supérieur,5,85,4,2,Z,,1425
1426,472,Commerce de détail alimentaire en magasin spécialisé,3,47,2,,,,1426
1427,949,Activités des autres organisations associatives,3,94,9,,,,1427
1428,4213A,Construction d'ouvrages d'art,5,42,1,3,A,,1428
1429,5530Z,"Terrains de camping et parcs pour caravanes, véhicules de loisirs",5,55,3,0,Z,,1429
1430,2813,Fabrication d'autres pompes et compresseurs,4,28,1,3,,,1430
1431,6311Z,"Traitement de données, hébergement et activités connexes",5,63,1,1,Z,,1431
1432,19,Cokéfaction et raffinage,2,19,,,,,1432
1433,2434Z,Tréfilage à froid,5,24,3,4,Z,,1433
1434,3320,Installation de machines et d'équipements industriels,4,33,2,0,,,1434
1435,9601,Blanchisserie-teinturerie,4,96,0,1,,,1435
1436,5590,Autres hébergements,4,55,9,0,,,1436
1437,1414Z,Fabrication de vêtements de dessous,5,14,1,4,Z,,1437
1438,0893Z,Production de sel,5,08,9,3,Z,,1438
1439,893,Production de sel,3,89,3,,,,1439
1440,2313,Fabrication de verre creux,4,23,1,3,,,1440
1441,4673B,Commerce de gros d'appareils sanitaires et produits de décoration,5,46,7,3,B,,1441
1442,1011,Transformation et conservation de la viande de boucherie,4,10,1,1,,,1442
1443,2016Z,Fabrication de matières plastiques de base,5,20,1,6,Z,,1443
1444,6110,Télécommunications filaires,4,61,1,0,,,1444
1445,4711,Comm. détail en magasin non spécialisé à prédominance alimentaire,4,47,1,1,,,1445
1446,6209,Autres activités informatiques,4,62,0,9,,,1446
1447,582,Édition de logiciels,3,58,2,,,,1447
1448,3811,Collecte des déchets non dangereux,4,38,1,1,,,1448
1449,279,Fabrication d'autres matériels électriques,3,27,9,,,,1449
1450,5010Z,Transports maritimes et côtiers de passagers,5,50,1,0,Z,,1450
1451,6622,Activités des agents et courtiers d'assurances,4,66,2,2,,,1451
1452,1072,"Fabrication de biscuits, biscottes et pâtisseries de conservation",4,10,7,2,,,1452
1453,774,Loc-bail de propriété intell. & sf oeuvres soumises à copyright,3,77,4,,,,1453
1454,6110Z,Télécommunications filaires,5,61,1,0,Z,,1454
1455,4779Z,Commerce de détail de biens d'occasion en magasin,5,47,7,9,Z,,1455
1456,79,"Activ. agences voyage, voyagistes, serv. résa. & activ. connexes",2,79,,,,,1456
1457,5610C,Restauration de type rapide,5,56,1,0,C,,1457
1458,9602A,Coiffure,5,96,0,2,A,,1458
1459,33,Réparation et installation de machines et d'équipements,2,33,,,,,1459
1460,8211,Services administratifs combinés de bureau,4,82,1,1,,,1460
1461,1012Z,Transformation et conservation de la viande de volaille,5,10,1,2,Z,,1461
1462,5222Z,Services auxiliaires des transports par eau,5,52,2,2,Z,,1462
1463,799,Autres services de réservation et activités connexes,3,79,9,,,,1463
1464,9810,Activ. indifférenciées ménages : producteurs biens (usage propre),4,98,1,0,,,1464
1465,212,Fabrication de préparations pharmaceutiques,3,21,2,,,,1465
1466,2630Z,Fabrication d'équipements de communication,5,26,3,0,Z,,1466
1467,2370Z,"Taille, façonnage et finissage de pierres",5,23,7,0,Z,,1467
1468,7410Z,Activités spécialisées de design,5,74,1,0,Z,,1468
1469,6810,Activités des marchands de biens immobiliers,4,68,1,0,,,1469
1470,6831,Agences immobilières,4,68,3,1,,,1470
1471,2599,Fabrication d'autres produits métalliques n.c.a.,4,25,9,9,,,1471
1472,4312B,Travaux de terrassement spécialisés ou de grande masse,5,43,1,2,B,,1472
1473,4623Z,Commerce de gros (commerce interentreprises) d'animaux vivants,5,46,2,3,Z,,1473
1474,5821,Édition de jeux électroniques,4,58,2,1,,,1474
1475,4644,"Commerce de gros de vaisselle, verrerie et produits d'entretien",4,46,4,4,,,1475
1476,80,Enquêtes et sécurité,2,80,,,,,1476
1477,9101Z,Gestion des bibliothèques et des archives,5,91,0,1,Z,,1477
1478,1071A,Fabrication industrielle de pain et de pâtisserie fraîche,5,10,7,1,A,,1478
1479,1412Z,Fabrication de vêtements de travail,5,14,1,2,Z,,1479
1480,5229,Autres services auxiliaires des transports,4,52,2,9,,,1480
1481,2812,Fabrication d'équipements hydrauliques et pneumatiques,4,28,1,2,,,1481
1482,4222,Construction de réseaux électriques et de télécommunications,4,42,2,2,,,1482
1483,6629,Aut. activités auxiliaires d'assurance et de caisses de retraite,4,66,2,9,,,1483
1484,433,Travaux de finition,3,43,3,,,,1484
1485,852,Enseignement primaire,3,85,2,,,,1485
1486,4651,"Comm. de gros d'ordinat., d'éqpts informatiq. périph. & logiciels",4,46,5,1,,,1486
1487,982,Activ. indifférenciées ménages : produc. services (usage propre),3,98,2,,,,1487
1488,1102B,Vinification,5,11,0,2,B,,1488
1489,2751Z,Fabrication d'appareils électroménagers,5,27,5,1,Z,,1489
1490,8230Z,"Organisation de foires, salons professionnels et congrès",5,82,3,0,Z,,1490
1491,7733Z,Location et location-bail machines bureau & matériel informatique,5,77,3,3,Z,,1491
1492,503,Transports fluviaux de passagers,3,50,3,,,,1492
1493,4399,Autres travaux de construction spécialisés n.c.a.,4,43,9,9,,,1493
1494,5821Z,Édition de jeux électroniques,5,58,2,1,Z,,1494
1495,115,Culture du tabac,3,11,5,,,,1495
1496,9420Z,Activités des syndicats de salariés,5,94,2,0,Z,,1496
1497,0230Z,Récolte prod. forestiers non ligneux poussant à l'état sauvage,5,02,3,0,Z,,1497
1498,0811Z,"Extraction pierres ornement. construc. calcaire industriel, gypse",5,08,1,1,Z,,1498
1499,6810Z,Activités des marchands de biens immobiliers,5,68,1,0,Z,,1499
1500,8559,Enseignements divers,4,85,5,9,,,1500
1501,1101,Production de boissons alcooliques distillées,4,11,0,1,,,1501
1502,1092,Fabrication d'aliments pour animaux de compagnie,4,10,9,2,,,1502
1503,2825,Fabrication équipements aérauliques et frigorifiques industriels,4,28,2,5,,,1503
1504,6619A,Supports juridiques de gestion de patrimoine mobilier,5,66,1,9,A,,1504
1505,4663Z,"Comm de gros de machines pour l'extrac, la constr, le génie civil",5,46,6,3,Z,,1505
1506,4634Z,Commerce de gros (commerce interentreprises) de boissons,5,46,3,4,Z,,1506
